{
  "$schema": "http://json-schema.org/draft-07/schema#",
  "$id": "https://clawrocket.dev/contracts/editorial-room/v0/theme.schema.json",
  "title": "ThemeCompiledTruth",
  "description": "Layer-1 page: durable subject area within the publication. See EDITORIAL_ROOM_CONTRACT.md §3.1.",
  "type": "object",
  "additionalProperties": false,
  "required": [
    "schema_version",
    "name",
    "description",
    "status",
    "pinned",
    "derived_from_pcp",
    "pcp_provenance",
    "derived_from_panel",
    "panel_provenance",
    "topic_count",
    "last_activity_at"
  ],
  "properties": {
    "schema_version": { "const": "0" },
    "name": { "type": "string", "minLength": 1 },
    "description": {
      "type": "string",
      "minLength": 1,
      "description": "1–3 sentence prose."
    },
    "status": {
      "type": "string",
      "enum": ["active", "parked", "archived"]
    },
    "pinned": {
      "type": "boolean",
      "description": "For Theme Library sorting."
    },
    "derived_from_pcp": { "type": "boolean" },
    "pcp_provenance": {
      "anyOf": [
        { "type": "null" },
        { "$ref": "https://clawrocket.dev/contracts/editorial-room/v0/pcp_provenance.schema.json" }
      ]
    },
    "derived_from_panel": { "type": "boolean" },
    "panel_provenance": {
      "anyOf": [
        { "type": "null" },
        { "$ref": "https://clawrocket.dev/contracts/editorial-room/v0/panel_provenance.schema.json" }
      ]
    },
    "topic_count": {
      "anyOf": [{ "type": "null" }, { "type": "integer", "minimum": 0 }],
      "description": "Computed; null if not yet computed."
    },
    "last_activity_at": {
      "anyOf": [{ "type": "null" }, { "type": "string", "format": "date-time" }],
      "description": "Computed; ISO timestamp of most recent topic update."
    }
  }
}
