{
  "schema_version": "0",
  "name": "AI Impact on Game Dev",
  "description": "How shipped tools, costs, and dev culture are changing under the LLM era — for game studios building today.",
  "status": "active",
  "pinned": true,
  "derived_from_pcp": false,
  "pcp_provenance": null,
  "derived_from_panel": false,
  "panel_provenance": null,
  "topic_count": 3,
  "last_activity_at": "2026-04-30T11:42:18.123Z"
}
